{
  "cache_invalidation_keys": [
    "source_commit=demo-target-abi-ulong-identity-20260708",
    "slice_spec_sha256=8984e96ff70a803447116f25ac67d07188b4880ce89099b49580fe7190e3537d",
    "fixture_hash=target-abi-ulong-identity-fixture",
    "build_profile_hash=b0330d12eed85cd57bda4f5fc400390bc81b0b8f2c67ad00203dd29c3e9ecc74",
    "translator_version=0.1.0",
    "schema_version=1"
  ],
  "functions": [
    {
      "basic_blocks": [
        {
          "id": "entry",
          "kind": "entry",
          "lvalue_decisions": [],
          "lvalue_kinds": [],
          "source_span": {
            "file": "slice-spec",
            "line_end": 1,
            "line_start": 1
          },
          "statement_kinds": [
            "return"
          ],
          "statements": [
            "return"
          ],
          "terminator": "return"
        }
      ],
      "branches": [],
      "edges": [
        {
          "from": "entry",
          "kind": "return",
          "source_span": {
            "file": "slice-spec",
            "line_end": 1,
            "line_start": 1
          },
          "to": "return-0"
        }
      ],
      "entry_block": "entry",
      "exit_blocks": [
        "return"
      ],
      "name": "target_abi_ulong_identity",
      "returns": [
        {
          "block": "entry",
          "expression": "",
          "source_span": {
            "file": "slice-spec",
            "line_end": 1,
            "line_start": 1
          }
        }
      ],
      "signature": "unsigned long target_abi_ulong_identity(unsigned long value)",
      "source_span": {
        "file": "slice-spec",
        "line_end": 1,
        "line_start": 1
      },
      "structured_control_flow": {
        "has_goto": false,
        "has_switch": false,
        "if_count": 0,
        "loop_count": 0,
        "recovery_status": "structured",
        "relooper_preconditions": [],
        "relooper_refusals": [],
        "relooper_required": false,
        "scope_note": "structured control flow does not require relooper recovery"
      }
    }
  ],
  "level": "L3",
  "repo_commit": "8e11561355d4ff2c674f395db1b6a2475c27478c",
  "schema_version": 1,
  "slice_id": "target-abi-ulong-identity",
  "slice_spec_ref": {
    "path": "validation/slice-specs/demo-target-abi-ulong-identity.json",
    "sha256": "8984e96ff70a803447116f25ac67d07188b4880ce89099b49580fe7190e3537d",
    "status": "ready"
  },
  "source_commit": "demo-target-abi-ulong-identity-20260708",
  "status": "recorded",
  "target_id": "demo",
  "unsupported_control_flow": []
}
