{
  "cache_invalidation_keys": [
    "source_commit=f9d0421315c564fb890a1b14eee77b290e0d7bbe",
    "slice_spec_sha256=8c67a57439f546f744dfc80e5f8500f203a69e397d1715bacbb5964ea12a5f41",
    "fixture_hash=e02a534008ee2572a432b8a44242876ed6565d9ffbfbb92baa284d05e247623b",
    "build_profile_hash=efe7aad87f39cfa5c70567e2cbe4e829579e6c2d301eab80bc9d300b93637cc4",
    "translator_version=0.1.0",
    "schema_version=1"
  ],
  "functions": [
    {
      "basic_blocks": [
        {
          "id": "entry",
          "kind": "entry",
          "lvalue_decisions": [
            {
              "decision": "bounded_pointer_index",
              "lvalue_kind": "bounded_pointer_index",
              "source_span": {
                "file": "slice-spec",
                "line_end": 1,
                "line_start": 1
              },
              "source_statement": "decl kv",
              "statement_index": 0,
              "translation_rule_id": "bounded-pointer-index-write"
            }
          ],
          "lvalue_kinds": [
            "bounded_pointer_index"
          ],
          "source_span": {
            "file": "slice-spec",
            "line_end": 1,
            "line_start": 1
          },
          "statement_kinds": [
            "primitive_declaration",
            "assignment",
            "return",
            "bounded_pointer_index_write"
          ],
          "statements": [
            "decl kv",
            "assign member iterated_obj_bytes",
            "return"
          ],
          "terminator": "return"
        }
      ],
      "branches": [],
      "edges": [
        {
          "from": "entry",
          "kind": "return",
          "source_span": {
            "file": "slice-spec",
            "line_end": 1,
            "line_start": 1
          },
          "to": "return-2"
        }
      ],
      "entry_block": "entry",
      "exit_blocks": [
        "return"
      ],
      "name": "fdb_kv_iterate_obj_bytes_probe",
      "returns": [
        {
          "block": "entry",
          "expression": "",
          "source_span": {
            "file": "slice-spec",
            "line_end": 1,
            "line_start": 1
          }
        }
      ],
      "signature": "bool fdb_kv_iterate_obj_bytes_probe(struct FdbKvIterator * itr)",
      "source_span": {
        "file": "slice-spec",
        "line_end": 1,
        "line_start": 1
      },
      "structured_control_flow": {
        "has_goto": false,
        "has_switch": false,
        "if_count": 0,
        "loop_count": 0,
        "recovery_status": "structured",
        "relooper_preconditions": [],
        "relooper_refusals": [],
        "relooper_required": false,
        "scope_note": "structured control flow does not require relooper recovery"
      }
    }
  ],
  "level": "L3",
  "repo_commit": "34634b13f9c5b132a1d24067a49ec5addacc8d9c",
  "schema_version": 1,
  "slice_id": "real-fdb-kv-iterate-obj-bytes",
  "slice_spec_ref": {
    "path": "validation/slice-specs/flashdb-real-fdb-kv-iterate-obj-bytes.json",
    "sha256": "8c67a57439f546f744dfc80e5f8500f203a69e397d1715bacbb5964ea12a5f41",
    "status": "ready"
  },
  "source_commit": "f9d0421315c564fb890a1b14eee77b290e0d7bbe",
  "status": "recorded",
  "target_id": "flashdb",
  "unsupported_control_flow": []
}
