{
  "cache_invalidation_keys": [
    "source_commit=demo-sum-i32-buffer-20260625",
    "slice_spec_sha256=00cd9f5abff8de94eca869ba982867cbdadf44754ffdf97592d96cc9caf956f6",
    "fixture_hash=sum-i32-buffer-fixture",
    "build_profile_hash=076d32e392f6a18e19179cd801a7464482b4b049dde5d4cb339ecb3bca018b61",
    "translator_version=0.1.0",
    "schema_version=1"
  ],
  "functions": [
    {
      "basic_blocks": [
        {
          "id": "entry",
          "kind": "entry",
          "lvalue_decisions": [
            {
              "decision": "bounded_input_buffer",
              "lvalue_kind": "bounded_input_buffer",
              "source_span": {
                "file": "slice-spec",
                "line_end": 1,
                "line_start": 1
              },
              "source_statement": "decl total",
              "statement_index": 0,
              "translation_rule_id": "bounded-input-buffer-read"
            },
            {
              "decision": "bounded_pointer_index",
              "lvalue_kind": "bounded_pointer_index",
              "source_span": {
                "file": "slice-spec",
                "line_end": 1,
                "line_start": 1
              },
              "source_statement": "for",
              "statement_index": 1,
              "translation_rule_id": "bounded-pointer-index-write"
            }
          ],
          "lvalue_kinds": [
            "bounded_input_buffer",
            "bounded_pointer_index"
          ],
          "source_span": {
            "file": "slice-spec",
            "line_end": 1,
            "line_start": 1
          },
          "statement_kinds": [
            "primitive_declaration",
            "for",
            "assignment",
            "return",
            "bounded_input_buffer_read",
            "pointer_write",
            "bounded_pointer_index_write"
          ],
          "statements": [
            "decl total",
            "for",
            "assign index",
            "return"
          ],
          "terminator": "return"
        }
      ],
      "branches": [],
      "edges": [
        {
          "from": "entry",
          "kind": "unsupported",
          "source_span": {
            "file": "slice-spec",
            "line_end": 1,
            "line_start": 1
          },
          "to": "for-1"
        },
        {
          "from": "entry",
          "kind": "return",
          "source_span": {
            "file": "slice-spec",
            "line_end": 1,
            "line_start": 1
          },
          "to": "return-3"
        }
      ],
      "entry_block": "entry",
      "exit_blocks": [
        "return"
      ],
      "name": "sum_i32_buffer",
      "returns": [
        {
          "block": "entry",
          "expression": "",
          "source_span": {
            "file": "slice-spec",
            "line_end": 1,
            "line_start": 1
          }
        }
      ],
      "signature": "int sum_i32_buffer(const int* values, int len, int* out)",
      "source_span": {
        "file": "slice-spec",
        "line_end": 1,
        "line_start": 1
      },
      "structured_control_flow": {
        "has_goto": false,
        "has_switch": false,
        "if_count": 0,
        "loop_count": 1,
        "recovery_status": "structured",
        "relooper_preconditions": [],
        "relooper_refusals": [],
        "relooper_required": false,
        "scope_note": "structured control flow does not require relooper recovery"
      }
    }
  ],
  "level": "L3",
  "repo_commit": "c7f4e5fbd261edce5be0019c5313750d91df1ede",
  "schema_version": 1,
  "slice_id": "sum-i32-buffer",
  "slice_spec_ref": {
    "path": "validation/slice-specs/demo-sum-i32-buffer.json",
    "sha256": "00cd9f5abff8de94eca869ba982867cbdadf44754ffdf97592d96cc9caf956f6",
    "status": "ready"
  },
  "source_commit": "demo-sum-i32-buffer-20260625",
  "status": "recorded",
  "target_id": "demo",
  "unsupported_control_flow": []
}
